,ID,name,category,main_category,currency,deadline,goal,launched,pledged,state,backers,country,usd pledged,usd_pledged_real,usd_goal_real,desc
187,1026969816,OpenTapp Alcohol Distribution App,Apps,Technology,USD,07-03-2016,60000,07-01-2016 13:45,23,failed,4,US,23,23,60000,"OpenTapp helps self-distributing alcohol manufacturers handle orders, gain contracts, and get their products to retail establishments."
188,102697452,Shut-App!,Apps,Technology,USD,25-08-2016,10800,26-07-2016 12:01,11029.67,successful,332,US,2751,11029.67,10800,"Take a stand. In the face of ignorance and bigotry - don't shut-up, Shut-App!"
189,1026976892,Your personal version of Drop Box you Control!,Web,Technology,USD,10-08-2014,50,11-07-2014 22:02,1,failed,1,US,1,1,50,Are you tired of not knowing who has access to your data? I'm building a small scale personal solution to help using OwnCloud
190,10270441,Io-1 -  A True LPT Parallel Port Cape For The Beaglebone.,Hardware,Technology,USD,01-01-2014,7400,02-12-2013 20:30,836,failed,13,US,836,836,7400,"The first fully compatible LPT hardware device for the Beaglebone Black. For hobbyists, developers, and designers!"
191,1027052134,iGeekReviews.com domain and hosting aquisition.,Web,Technology,USD,23-02-2015,500,29-01-2015 04:06,7,failed,3,US,7,7,500,iGeekReviews.com is a tech review website. We have a BETA with a long URL sosoaspm2.wix.com/iGeek and seek a legit domain and hosting.
192,1027263169,California Drought Solution Database,Software,Technology,USD,24-07-2016,17000,25-05-2016 15:25,500,failed,1,US,500,500,17000,A free-for-everyone reference of data designed to reduce part of the 60%* of water usage in California..
193,1027739962,Robogaia 2D Robotic Obstacle Detector,Hardware,Technology,USD,06-10-2014,39999,27-08-2014 02:36,2456,failed,24,US,2456,2456,39999,The Robogaia 2D Robotic Obstacle is a tool that allows your robot to determine the distance to obstacles  and walls and to avoid them.
194,1027758812,Imagine a dating site for addicts & sponsors. Sponsorfinder,Web,Technology,USD,01-08-2015,20588,08-07-2015 17:04,5,failed,1,US,5,5,20588,With your help addicts will be able to get the support they need to get clean. Sponsorfinder is a site that connects sponsors & addicts
195,10278585,iRMimic - Making TV Simple Again!,Gadgets,Technology,USD,01-08-2016,75000,30-06-2016 23:37,1350,failed,8,US,960,1350,75000,"Solve your input confusion at the push of a button with a learning remote that syncs your TV, cable box, HDMI & other A/V components!"
196,1028052051,"Steyelr, dress better.",Apps,Technology,USD,29-01-2015,24000,26-12-2014 18:00,937,failed,16,US,937,937,24000,Struggle picking out clothes to wear or when you're out shopping? Can't decide between two things? Steyelr is the app for you!
197,1028176650,Sitenel.com - Real Time Monitoring (Canceled),Web,Technology,USD,10-03-2016,8500,09-02-2016 22:27,0,canceled,0,US,0,0,8500,"Can you afford to have your website, app, or api down? Sitenel.com is a realtime monitoring service built for humans."
198,1028259978,Keplero Luxury Wallet - Strong RFID-Blocking,Gadgets,Technology,USD,29-08-2015,10000,30-06-2015 06:01,582634,successful,3792,US,582634,582634,10000,Keplero is the first magnetic Luxury Wallet made of pure carbon fiber. The thinnest and lightest ever.
199,1028377633,iKready!,Web,Technology,USD,02-06-2015,12000,13-05-2015 21:57,650,failed,4,US,650,650,12000,I want to create a website that will give parents early insight into their child's kindergarten preparedness
200,1028663771,Secured Mobile Video - Police Body Camera (Canceled),Camera Equipment,Technology,USD,08-12-2014,220000,09-10-2014 21:35,0,canceled,0,US,0,0,220000,Revolutionary equipment to make life as a law enforcement officer easier and keep them accountable for their actions...
